filename,text
critical-bluetooth-flaw-exposes-android-apple-and-linux-devices-to-keystroke-injection-attack.json,"Attackers can exploit a critical Bluetooth security vulnerability that's been lurking largely unnoticed for years on macOS, iOS, Android, and Linux device platforms. The keystroke injection vulnerability allows an attacker to control the targeted device as if they were attached by a Bluetooth keyboard, performing various functions remotely depending on the endpoint. Tracked as CVE-2023-45866, the flaw exists in how in the Bluetooth protocol is implemented on various platforms. It works by tricking the Bluetooth host state-machine into pairing with a fake keyboard without user confirmation. The vulnerability enables an attacker to pair an emulated Bluetooth keyboard with a victim's phone or computer, implementing the keyboard as a Python script that runs on a Linux computer. The attacker can then inject keystrokes, typing on the target device as if they were a Bluetooth keyboard legitimately attached to the target."
exposing-initial-access-broker-ties-conti.json,"In early September 2021, Threat Analysis Group (TAG) observed a financially motivated threat actor we refer to as EXOTIC LILY, exploiting a 0day in Microsoft MSHTML (CVE-2021-40444). Investigating this group's activity, we determined they are an Initial Access Broker (IAB) who appear to be working with the Russian cyber crime gang known as FIN12 (Mandiant, FireEye) / WIZARD SPIDER (CrowdStrike). Initial access brokers are the opportunistic locksmiths of the security world, and it’s a full-time job. These groups specialize in breaching a target in order to open the doors-or the Windows-to the malicious actor with the highest bid. EXOTIC LILY is a resourceful, financially motivated group whose activities appear to be closely linked with data exfiltration and deployment of human-operated ransomware such as Conti and Diavol. At the peak of EXOTIC LILY’s activity, we estimate they were sending more than 5,000 emails a day, to as many as 650 targeted organizations globally. Up until November 2021, the group seemed to be targeting specific industries such as IT, cybersecurity and healthcare, but as of late we have seen them attacking a wide variety of organizations and industries, with less specific focus."
google-patches-chromes-fifth-zero-day-of-the-year.json,"Google has patched the fifth actively exploited zero-day vulnerability discovered in Chrome this year as one in a series of fixes included in a stable channel update released Wednesday. The bug, tracked as CVE-2022-2856 and rated as high on the Common Vulnerability Scoring System (CVSS), is associated with “insufficient validation of untrusted input in Intents,” according to the advisory posted by Google. Google credits Ashley Shen and Christian Resell of its Google Threat Analysis Group (TAG) for reporting the zero-day bug, which could allow for arbitrary code execution, on July 19. The advisory also unveiled 10 other patches for various other Chrome issues."
in-depth-look-at-apt35-aka-charming-kitten.json,"The Iranian advanced persistent threat actor and cyberespionage group, APT35, also known as Charming Kitten or Phosphorus, has been making headlines since 2014. During that time, the group launched one of the most sophisticated internet based spying campaigns organized by Iranian threat actors - a campaign conducted via social media. Since then, the group has not slowed down and has been responsible for several other cyber attacks around the world. In 2019, APT35 was responsible for targeting several academic institutions in the U.S, France, and the Middle East region. In late 2020, the group targeted medical research organizations in Israel and in the U.S. By 2021, APT35 was abusing Microsoft Exchange Server vulnerabilities that were chained together (ProxyShell). As of 2022, APT35 has been observed using new tactics to attack a wide range of targets. Using a new strain of malware, the threat actors were able to use the malware for intelligence collection. The group has also been seen using a new tool called Hyperscrape to quietly extract emails from victim's mailboxes."
reservation-links-prey-on-travelers.json,"A longtime threat group identified as TA558 has ramped up efforts to target the travel and hospitality industries. After a lull in activity, believed tied to COVID-related travel restrictions, the threat group has ramped up campaigns to exploit an uptick in travel and related airline and hotel bookings. Warnings come from security researchers who say TA558 cybercriminals have revamped their 2018 campaigns with fake reservation emails that contain links – that if clicked – deliver a malicious malware payload containing a potpourri of malware variants. What makes this most recent campaign unique, according to a report by Proofpoint, is the use of RAR and ISO file attachments linked to messages. ISO and RAR are single compressed files, that if executed, decompress the file and folder data inside of them."
new-rugmi-malware-loader-surges-with.json,"A new malware loader is being used by threat actors to deliver a wide range of information stealers such as Lumma Stealer (aka LummaC2), Vidar, RecordBreaker (aka Raccoon Stealer V2), and Rescoms. Cybersecurity firm ESET is tracking the trojan under the name Win/TrojanDownloader.Rugmi. This malware is a loader with three types of components: a downloader that downloads an encrypted payload, a loader that runs the payload from internal resources, and another loader that runs the payload from an external file on the disk. Telemetry data gathered by the company shows that detections for the Rugmi loader spiked in October and November 2023, surging from single digit daily numbers to hundreds per day. Stealer malware is typically sold under a malware-as-a-service (MaaS) model to other threat actors on a subscription basis. Lumma Stealer, for instance, is advertised in underground forums for $250 a month. The most expensive plan costs $20,000, but it also gives the customers access to the source code and the right to sell it."
