filename,text
zimbra-0-day-used-to-target-international-government-organizations.json,"In June 2023, Google’s Threat Analysis Group (TAG) discovered an in-the-wild 0-day exploit targeting Zimbra Collaboration, an email server many organizations use to host their email. Since discovering the 0-day, now patched as CVE-2023-37580, TAG has observed four different groups exploiting the same bug to steal email data, user credentials, and authentication tokens. Most of this activity occurred after the initial fix became public on Github. CVE-2023-37580 is a reflected cross-site scripting (XSS) vulnerability. XSS is a web application vulnerability that allows malicious scripts to be injected into another website. In this case, there was a vulnerability in Zimbra that injected the parameter within the URL directly into the webpage, causing the script to be executed. "
equation-cyberespionage-group_1.json,"Equation has employed a number of specialist tools. Among these are Trojan.Grokey a custom keylogger (also known as “Grok”) and W32.Fanni, which is also known as “Fanny worm”. This worm's chief purpose appears to be the targeting of air-gapped networks. It can receive commands and exfiltrate data through infected USB sticks. Fanny used two zero day exploits that were also used in the Stuxnet attacks. The exploits were used in Fanny prior to Stuxnet indicating that Equation had prior knowledge of the vulnerabilities. Another similarity lies in the fact that Stuxnet was also designed to attack air-gapped networks."
cl0p-group-distributes-ransomware-data-with-torrents.json,The CL0P ransomware group recently began using torrents to distribute victim data after a successful campaign stealing data from thousands of companies. We'll cover the reason for this shift in methodology and what this means for visibility to the outside world. CL0P has been one of the ransomware groups most actively posting data about their victims on leak sites tracked by Unit 42 (second only to LockBit in 2023). Unit 42 consultants have recently observed CL0P in about 10 incident response cases.
google-tag-coldriver-russian-phishing-malware.json,"Over the years, TAG has analyzed a range of persistent threats including COLDRIVER (also known as UNC4057, Star Blizzard and Callisto), a Russian threat group focused on credential phishing activities against high profile individuals in NGOs, former intelligence and military officers, and NATO governments. For years, TAG has been countering and reporting on this group’s efforts to conduct espionage aligned with the interests of the Russian government. To add to the community’s understanding of COLDRIVER activity, we’re shining light on their extended capabilities which now includes the use of malware. COLDRIVER continues its focus on credential phishing against Ukraine, NATO countries, academic institutions and NGOs. In order to gain the trust of targets, COLDRIVER often utilizes impersonation accounts, pretending to be an expert in a particular field or somehow affiliated with the target. The impersonation account is then used to establish a rapport with the target, increasing the likelihood of the phishing campaign's success, and eventually sends a phishing link or document containing a link."
exposing-earth-berberoka-a-multiplatform-apt-campaign-targeting-online-gambling-sites.json,"We have discovered an advanced persistent threat (APT) group that primarily targets online gambling sites. This group, which we have dubbed Earth Berberoka (aka GamblingPuppet), uses old yet upgraded malware families that have been attributed to Chinese-speaking actors, including PlugX and Gh0st RAT. It also uses a brand-new multistage malware family, which we have dubbed PuppetLoader. The malware families used by Earth Berberoka are multiplatform, targeting the Windows, Linux, and macOS operating systems."
iran-apt-seedworm-africa-telecoms.json,"Iranian espionage group Seedworm (aka Muddywater) has been targeting organizations operating in the telecommunications sector in Egypt, Sudan, and Tanzania. Seedworm has been active since at least 2017, and has targeted organizations in many countries, though it is most strongly associated with attacks on organizations in the Middle East. It has been publicly stated that Seedworm is a cyberespionage group that is believed to be a subordinate part of Iran's Ministry of Intelligence and Security (MOIS). The attackers used a variety of tools in this activity, which occurred in November 2023, including leveraging the MuddyC2Go infrastructure, which was recently discovered and documented by Deep Instinct. Researchers on Symantec's Threat Hunter Team, part of Broadcom, found a MuddyC2Go PowerShell launcher in the activity we investigated. The attackers also use the SimpleHelp remote access tool and Venom Proxy, which have previously been associated with Seedworm activity, as well as using a custom keylogging tool, and other publicly available and living-off-the-land tools."
hackers-start-exploiting-critical-atlassian-confluence-rce-flaw.json,Security researchers are observing exploitation attempts for the CVE-2023-22527 remote code execution flaw vulnerability that affects outdated versions of Atlassian Confluence servers. The flaw has a critical severity score and is described as a template injection weakness that allows unauthenticated remote attackers to execute code on vulnerable Confluence Data Center and Confluence Server endpoints. The service says that attackers are trying out callbacks by executing the 'whoami' command to gather information about the level of access and privileges on the system.
purplefox-malware-infects-thousands-of-computers-in-ukraine.json,"PurpleFox (or 'DirtyMoe') is a modular Windows botnet malware first spotted in 2018 that comes with a rootkit module allowing it to hide and persist between device reboots. It can be used as a downloader that introduces more potent second-stage payloads on compromised systems, offers its operators backdoor capabilities, and can also act as a distributed denial of service (DDoS) bot. In October 2021, researchers noticed that new versions of PurpleFox switched to using WebSocket for command and control (C2) communications for stealth. In January 2022, a campaign spread the malware under the guise of a Telegram desktop app. CERT-UA used IoCs shared by Avast and TrendMicro to identify PurpleFox malware infections on Ukrainian computers, tracking the activity under the identifier 'UAC-0027'. CERT-UA says PurpleFox typically infects systems when victims launch laced MSI installers and highlights its self-propagation capabilities using exploits for known flaws and password brute-forcing."
