filename,text
ryuk-2020-distributing-ransomware-via-trickbot-and-bazarloader.json,"Starting this year, Ryuk began using another dropper called BazarLoader (also known as BazarBackdoor). Like Trickbot, BazarLoader is also primarily distributed via phishing emails that contain either malicious attachments or links to websites (typically free, online file-hosting solutions) that host malware. These phishing emails use normal social engineering techniques: For example, they are usually disguised as business correspondence or other important messages. Once the payload is distributed, a command-and-control (C&C) server is used to deploy and install the backdoor. According to the advisory, the threat actor behind TrickBot is also connected to BazarLoader."
chromeloader-hijacker-threats.json,"ChromeLoader may seem on the surface like a run-of-the-mill browser hijacker that merely redirects victims to advertisement websites. However, its use of PowerShell could pose a greater risk by leading to further and advanced malicious activity, such as the propagation of ransomware or spyware or theft of browser-session data. Researchers are warning of the potential for ChromeLoader-which has seen a resurgence in activity recently-to pose a more sophisticated threat than typical malvertisers do, according to two separate blog posts by Malwarebytes Labs and Red Canary. ChromeLoader is a pervasive and persistent browser hijacker that eventually manifests as a browser extension, modifying victims’ Chrome settings and redirecting user traffic to advertisement websites. On Windows machines, victims become infected with the malware through ISO files that poses as a cracked video game or pirated films or TV programs."
kasseika-ransomware-uses-antivirus-driver-to-kill-other-antiviruses.json,"A recently uncovered ransomware operation named 'Kasseika' has joined the club of threat actors that employs Bring Your Own Vulnerable Driver (BYOVD) tactics to disable antivirus software before encrypting files. Kasseika abuses the Martini driver (Martini.sys/viragt64.sys), part of TG Soft's VirtIT Agent System, to disable antivirus products protecting the targeted system. Kasseika attacks start with a phishing email sent to employees of the targeted organization, attempting to steal their account credentials, which will then be used for initial access to the corporate network. Next, Kasseika operators abuse the Windows PsExec tool to execute malicious .bat files on the infected system and others they have accessed through lateral movement. The batch file checks for the presence of a process named 'Martini.exe' and terminates it to avoid interference. Next, it downloads the vulnerable 'Martini.sys' driver on the machine. By using BYOVD attacks, aka exploiting flaws in the loaded driver, the malware gains the privileges to terminate 991 processes from a hardcoded list, many of which correspond to antivirus products, security tools, analysis tools, and system utilities."
attackers-exploit-microsoft-office-bug-spyware.json,"Attackers are exploiting a 6-year-old Microsoft Office remote code execution (RCE) flaw to deliver spyware, in an email campaign weaponized by malicious Excel attachments and characterized by sophisticated evasion tactics. Threat actors dangle lures relating to business activity in spam emails that deliver files that contain CVE-2017-11882, an RCE flaw that dates back to 2014 and can allow for system takeover, Zscaler revealed in a blog post published Dec. 19. The end goal of the attack is to load Agent Tesla, a remote access Trojan (RAT) and advanced keylogger first discovered in 2014, and exfiltrate credentials and other data from an infected system via a Telegram bot run by the attackers."
new-macos-vulnerability-migraine-could-bypass-system-integrity-protection.json,"A new vulnerability, which we refer to as “Migraine” for its involvement with macOS migration, could allow an attacker with root access to automatically bypass System Integrity Protection (SIP) in macOS and perform arbitrary operations on a device. We shared these findings with Apple through Coordinated Vulnerability Disclosure (CVD) via Microsoft Security Vulnerability Research (MSVR). A fix for this vulnerability, now identified as CVE-2023-32369, was included in the security updates released by Apple on May 18, 2023."
operation-earth-kitsune-tracking-slub-s-current-operations.json,"We found Operation Earth Kitsune using a total of five C&C servers, seven samples, and four new bugs, aiming to compromise websites to host malware. We initiated our investigation after noticing that the Korean American National Coordinating Council (KANCC) website was redirecting visitors to the Hanseattle website. Users who accessed the said site were redirected to a weaponized version of a proof of concept (POC) for the CVE-2019-5782 Google Chrome vulnerability published in the chromium tracking system. Digging deeper, we discovered that the attack does not only involve a weaponized version of the mentioned Chrome exploit; the exploit was infecting the victim machine with three separate malware samples."
