filename,text
magnet-goblin-delivers-linux-malware-using-one-day-vulnerabilities.json,"A financially motivated threat actor has been targeting one-day vulnerabilities in public-facing services to deploy Linux backdoors, Check Point reports. Tracked as Magnet Goblin, the adversary was seen quickly adopting one-day vulnerabilities, often in edge devices, and relying on the Nerbian custom malware family to perform nefarious activities. Magnet Goblin was seen targeting publicly disclosed vulnerabilities in Ivanti VPNs (CVE-2023-46805, CVE-2024-21887, CVE-2024-21888, and CVE-2024-21893), Magento (CVE-2022-24086), Qlik Sense (CVE-2023-41265, CVE-2023-41266, and CVE-2023-48365), and possibly Apache ActiveMQ. As part of an attack exploiting the recent Ivanti flaws, the threat actor was observed deploying a JavaScript credential stealer called Warpwire, a Linux variant of the NerbianRAT backdoor, and the open source tunneling tool Ligolo. The Warpwire stealer was previously linked to the mass exploitation of Ivanti vulnerabilities, suggesting that multiple threat actors might be using it, Check Point says. The tool was also seen in a 2022 attack against Magento servers, which were used as command-and-control (C&C) servers for the Windows variant of NerbianRAT and for Warpwire. Magnet Goblin deployed MiniNerbian, a smaller version of the Linux NerbianRAT backdoor, on the compromised Magento instances."
ransomware-spotlight-targetcompany.json,"In an interview in January 2023, threat actors behind TargetCompany clarified that each major update of the ransomware entailed a change in the encryption algorithm and different decryptor characteristics. These are accompanied by a change in file name extensions, hence the evolution of names by which the ransomware group is known. We will discuss this evolution further in our blog entry. TargetCompany's earlier variants provided a “.onion” contact site for negotiations and dropped ransom notes named How to decrypt files.txt. Meanwhile, later variants of the TargetCompany ransomware no longer use the name of the targeted enterprise as file name extensions. In mid- to late 2022, the group was given the name Fargo due to the extension that it added to its encrypted files in that period. Other extensions used by the ransomware group include “.mallox,” and “.xollam.” These later variants were observed using a combination of Chacha20, Curve 25519, and AES-128 algorithms to encrypt the victim's files. The ransomware group eventually established a data leak site under the name Mallox, and later variants dropped ransom notes as HOW TO RECOVER!!.txt."
critical-zero-day-in-apache-ofbiz-erp.json,"A new zero-day security flaw has been discovered in Apache OfBiz, an open-source Enterprise Resource Planning (ERP) system that could be exploited to bypass authentication protections.The vulnerability, tracked as CVE-2023-51467, resides in the login functionality and is the result of an incomplete patch for another critical vulnerability (CVE-2023-49070, CVSS score: 9.8) that was released earlier this month. CVE-2023-49070 refers to a pre-authenticated remote code execution flaw impacting versions prior to 18.12.10 that, when successfully exploited, could allow threat actors to gain full control over the server and siphon sensitive data. It is caused due to a deprecated XML-RPC component within Apache OFBiz. CVE-2023-51467 could be triggered using empty and invalid USERNAME and PASSWORD parameters in an HTTP request to return an authentication success message, effectively circumventing the protection and enabling a threat actor to access otherwise unauthorized internal resources."
new-macos-vulnerability-migraine-could-bypass-system-integrity-protection.json,"A new vulnerability, which we refer to as “Migraine” for its involvement with macOS migration, could allow an attacker with root access to automatically bypass System Integrity Protection (SIP) in macOS and perform arbitrary operations on a device. We shared these findings with Apple through Coordinated Vulnerability Disclosure (CVD) via Microsoft Security Vulnerability Research (MSVR). A fix for this vulnerability, now identified as CVE-2023-32369, was included in the security updates released by Apple on May 18, 2023."
microsoft-patches-dogwalk-zero-day-and-17-critical-flaws.json,"Microsoft is urging users to patch a zero-day vulnerability dubbed Dogwalk that is actively being exploited in the wild. The bug (CVE-2022-34713) is tied to a Microsoft Windows Support Diagnostic Tool and allows a remote attacker to execute code on a vulnerable system. The warning is part of a massive August Patch Tuesday update that included 121 flaws, 17 of which were critical and 101 carrying a Common Vulnerability Scoring System rating of Important. Microsoft states that CVE-2022-34713 is a “variant of” Dogwalk, but different. Microsoft scored the vulnerability as Important and warns that the exploitation of the bug can only be preformed by an adversary with physical access to a vulnerable computer."
mispadu-banking-trojan-resurfaces.json,"Recent spam campaigns leading to URSA/Mispadu banking trojan (detected by Trend Micro as TrojanSpy.Win32.MISPADU.THIADBO) have been uncovered, as reported by malware analyst Pedro Tavares in a Twitter post and by Seguranca Informatica in a blog post. Mispadu malware steals credentials from users' systems. This attack targets systems with Spanish and Portuguese as system languages. It is also likely that they have targets similar to previous Mispadu attacks where users from Mexico, Spain, Portugal, and other nearby regions were targeted. This behavior is in line with past Mispadu schemes, such as the one where spam emails for fake discount coupons were used as bait."
recent-teamcity-vulnerability-exploited-in-ransomware-attacks.json,"A TeamCity vulnerability disclosed recently in controversial circumstances is being exploited in ransomware attacks, according to the product’s developer and cybersecurity companies. On March 4, JetBrains, the developer of the TeamCity build management and continuous integration server, announced fixes for CVE-2024-27198 and CVE-2024-27199, two serious authentication bypass vulnerabilities. CVE-2024-27198, which has been rated critical, can be exploited by remote, unauthenticated attackers to take complete control of a server by creating a new admin user account or by generating an admin access token. Rapid7, whose researchers discovered the vulnerabilities, made public details of CVE-2024-27198 and CVE-2024-27199 a few hours after JetBrains announced fixes. Full disclosure seems to have occurred due to miscommunication between the two companies. Rapid7 was concerned that JetBrains would try to silently patch the vulnerabilities and the vendor was concerned that Rapid7 would disclose details too quickly. JetBrains informed customers about patches without notifying Rapid7, which decided to immediately This led to threat actors beginning to target CVE-2024-27198 shortly after disclosure on March 4. By March 6, LeakIX, a project that scans the web for vulnerable and misconfigured systems, started seeing mass exploitation, with signs of rogue user creation seen in 1,400 instances. GuidePoint Security reported on Friday that a ransomware group named BianLian, which has been known to target critical infrastructure, may have exploited CVE-2024-27198 for initial access. "
apt-lazarus-macos-malware.json,"North Korean APT Lazarus is up to its old tricks with a cyberespionage campaign targeting engineers with a fake job posting that attempt to spread macOS malware. The malicious Mac executable used in the campaign targets both Apple and Intel chip-based systems. The campaign, identified by researchers from ESET Research Labs and revealed in a series of tweets posted Tuesday, impersonates cryptocurrency trader Coinbase in a job description claiming to seek an engineering manager for product security, researchers divulged. Dubbed Operation Interception, the recent campaign drops a signed Mac executable disguised as a job description for Coinbase, which researchers discovered uploaded to VirusTotal from Brazil. Malware is compiled for both Intel and Apple Silicon. It drops three files: a decoy PDF document Coinbase_online_careers_2022_07.pdf, a bundle http[://]FinderFontsUpdater[.]app and a downloader safarifontagent.”"
new-ransomware-strains-cryptnet-mallox-and-xollam.json,"Mallox ransomware specifically targets computers running Microsoft Windows. This ransomware was first observed in June 2021 and is known for exploiting unsecured MS-SQL servers as a penetration vector to compromise victims' networks. The ransomware's targeted industries are manufacturing, professional and legal services, and wholesale and retail. The ransomware operators claim that their victims include worldwide organizations. According to Lior Rochberger, a senior security researcher at Palo Alto Networks, Mallox's sudden increase in activity is attributed to the deliberate actions taken by the group's leaders to expand Mallox's operations. Rochberger stated that group appeared to focus more on recruiting affiliates at the beginning of 2023. This shift in strategy explains the significant increase observed this year. Recently, researchers from Unit 42 have noticed a significant increase in Mallox ransomware activity, with a surge of almost 174% compared to 2022. This increase is primarily due to Mallox using vulnerable MS-SQL (CVE-2020-0618 and CVE-2019-1068) servers to spread the ransomware. Unit 42 also observed Mallox using tactics such as brute force, data exfiltration, and the use of network scanning tools. Researchers have also reported that the group has attempted to distribute Mallox via phishing emails - suggesting affiliates may be involved. Once the threat actors gain access, they use the command line and PowerShell to download the Mallox ransomware payload from a remote server. Like other ransomware groups, the initial payload tries to deactivate any services that might hinder data encryption on the targeted system. Also, it tries to erase shadow copies, making data recovery more challenging after encryption. The malware also attempts to eliminate all event logs, utilizing a commonly used Microsoft command utility to try and complicate forensic analysis. Like CryptNet, the threat actors behind Mallox use the double extortion method - stealing data before encrypting it. They also have a data leak site where they leak the data of victims that refuse to pay or negotiate its ransom demands. Victims negotiate with the threat actors by using a private key to authenticate themselves. As previously stated, the ransomware operators claim to have breached hundreds of organizations worldwide. Unit 42 stated that their telemetry indicates at least dozens of potential Mallox victims. In 2022, Mallox ransomware was discovered to be a variant of the TargetCompany ransomware strain."
